{
  "tenantId": "00000000-0000-0000-0000-000000000001",
  "siteId": "00000000-0000-0000-0000-000000000002",
  "assetId": "00000000-0000-0000-0000-000000000003",
  "channelId": "00000000-0000-0000-0000-000000000004",
  "schemaVersion": "telemetry-envelope/1.0",
  "type": "temperature",
  "value": 4.2,
  "unit": "Cel",
  "eventTime": "2026-08-17T14:00:00.000Z",
  "ingestedAt": "2026-08-17T14:00:03.000Z",
  "quality": "ok",
  "idempotencyKey": "gw-01:4:2026-08-17T14:00:00.000Z"
}
